{
  "version": "replay-eval-contract.v1",
  "pass_rule": {
    "sample_pass": "pass == true",
    "overall_min_pass_rate": 1.0
  },
  "match_strategy": {
    "string": "normalized_exact",
    "structured": "field_exact"
  },
  "samples": [
    {
      "sample_id": "s1",
      "input": "2+2",
      "expected": "4",
      "tags": ["math", "smoke"]
    },
    {
      "sample_id": "s2",
      "input": {
        "question": "capital of Fujian"
      },
      "expected": {
        "answer": "Fuzhou"
      },
      "tags": ["geo"]
    }
  ],
  "results": [
    {
      "sample_id": "s1",
      "actual": "4",
      "pass": true,
      "score": 1,
      "reason": "string normalized exact match"
    },
    {
      "sample_id": "s2",
      "actual": {
        "answer": "Fuzhou"
      },
      "pass": true,
      "score": 1,
      "reason": "structured field exact match"
    }
  ]
}
